{
  "event_id": "01JB0000000000000000000000",
  "schema_version": 1,
  "node_id": "node-a",
  "session_id": "sess-1",
  "agent_id": "agent-1",
  "harness": "codex",
  "adapter_type": "none",
  "source_quality": "bootstrap_pipe_pane",
  "event_type": "capture.chunk",
  "direction": "out",
  "stream": "pty",
  "origin": "harness",
  "wall_time": "2026-10-26T12:41:02.314+01:00",
  "monotonic_ns": 883425102931,
  "sequence": 18382,
  "payload": {
    "capture_session_id": "cap-1",
    "byte_count": 24,
    "ansi_present": true,
    "raw_blob_ref": "blob://capture/cap-1/0001"
  },
  "sensitivity": "normal",
  "redaction_applied": false
}
